{
  "$schema": "https://json-schema.org/draft/2020-12/schema",
  "title": "Vulnerability Finding",
  "description": "Common vulnerability-result format used by all security analysis components.",
  "type": "object",

  "required": [
    "id",
    "source",
    "title",
    "severity",
    "confidence",
    "description"
  ],

  "properties": {
    "id": {
      "type": "string",
      "description": "Unique identifier for this finding."
    },

    "source": {
      "type": "string",
      "enum": [
        "static_analysis",
        "llm",
        "dependency"
      ],
      "description": "Component that produced the finding."
    },

    "title": {
      "type": "string",
      "description": "Short human-readable vulnerability title."
    },

    "severity": {
      "type": "string",
      "enum": [
        "low",
        "medium",
        "high",
        "critical"
      ]
    },
    "exploitability": {
    "type": "number",
    "minimum": 0,
    "maximum": 10
    },

    "impact": {
        "type": "number",
        "minimum": 0,
        "maximum": 10
    },

    "risk_score": {
        "type": "number",
        "minimum": 0,
        "maximum": 10
    },

    "confidence": {
      "type": "number",
      "minimum": 0,
      "maximum": 1,
      "description": "Confidence that the finding is valid."
    },

    "description": {
      "type": "string",
      "description": "Explanation of why the finding is a security concern."
    },

    "location": {
      "type": "object",

      "properties": {
        "file": {
          "type": "string"
        },

        "line": {
          "type": "integer",
          "minimum": 1
        },

        "column": {
          "type": "integer",
          "minimum": 1
        }
      },

      "additionalProperties": false
    },

    "evidence": {
      "type": "string",
      "description": "Relevant code or evidence supporting the finding."
    },

    "remediation": {
      "type": "string",
      "description": "Suggested way to fix the vulnerability."
    },

    "cwe": {
      "type": "string",
      "description": "Common Weakness Enumeration identifier."
    },

    "rule_id": {
      "type": "string",
      "description": "Identifier of the static-analysis rule, if applicable."
    },

    "package": {
      "type": "string",
      "description": "Affected dependency/package, if applicable."
    },

    "version": {
      "type": "string",
      "description": "Affected dependency version, if applicable."
    },

    "cve": {
      "type": "string",
      "description": "CVE identifier, if applicable."
    }
  },

  "additionalProperties": false
}